the first time i ever came here i had an amazing experience i still tell people how awesome the duck was	1
i love this place	1
i can say that the desserts were yummy	1
the seasonal fruit was fresh white peach puree	1
i love that they put their food in nice plastic containers as opposed to cramming it in little paper takeout boxes	1
the crêpe was delicate and thin and moist	1
best service and food ever maria our server was so good and friendly she made our day	1
they were excellent	1
just had lunch here and had a great experience	1
i recently tried caballeros and i have been back every week since	1
the food came out at a good pace	1
i ate there twice on my last visit and especially enjoyed the salmon salad	1
in fact im going to round up to 4 stars just because she was so awesome	1
the potatoes were great and so was the biscuit	1
so flavorful and has just the perfect amount of heat	1
the price is reasonable and the service is great	1
went in for happy hour great list of wines	1
some may say this buffet is pricey but i think you get what you pay for and this place you are getting quite a lot	1
this place is pretty good nice little vibe in the restaurant	1
talk about great customer service of course we will be back	1
i love their fries and their beans	1
always a pleasure dealing with him	1
they have a plethora of salads and sandwiches and everything ive tried gets my seal of approval	1
this place is awesome if you want something light and healthy during the summer	1
for sushi on the strip this is the place to go	1
the service was great even the manager came and helped with our table	1
all in all an excellent restaurant highlighted by great service a unique menu and a beautiful setting	1
my boyfriend and i sat at the bar and had a completely delightful experience	1
go to place for gyros	1
i love the owner/chef his one authentic japanese cool dude	1
we definately enjoyed ourselves	1
seriously killer hot chai latte	1
my boyfriend tried the mediterranean chicken salad and fell in love	1
their rotating beers on tap is also a highlight of this place	1
if you stay in vegas you must get breakfast here at least once	1
i want to first say our server was great and we had perfect service	1
the pizza selections are good	1
i had strawberry tea which was good	1
overall a great experience	1
their regular toasted bread was equally satisfying with the occasional pats of butter mmmm	1
the chips and sals a here is amazing	1
this is my new fav vegas buffet spot	1
every time i eat here i see caring teamwork to a professional degree	1
the best scene in the movie was when gerardo is trying to find a song that keeps running through his head  	1
saw the movie today and thought it was a good effort good messages for kids  	1
loved the casting of jimmy buffet as the science teacher  	1
and those baby owls were adorable  	1
the movie showed a lot of florida at its best made it look very appealing  	1
the songs were the best and the muppets were so hilarious  	1
it was so cool  	1
this is a very "right on casemovie that delivers everything almost right in your face  	1
this review is long overdue since i consider a tale of two sisters to be the single greatest film ever made  	1
ill put this gem up against any movie in terms of screenplay cinematography acting postproduction editing directing or any other aspect of filmmaking  	1
its practically perfect in all of them a true masterpiece in a sea of faux "masterpieces  	1
the structure of this film is easily the most tightly constructed in the history of cinema  	1
i can think of no other film where something vitally important occurs every other minute  	1
in other words the content level of this film is enough to easily fill a dozen other films  	1
how can anyone in their right mind ask for anything more from a movie than this  	1
its quite simply the highest most superlative form of cinema imaginable  	1
yes this film does require a rather significant amount of puzzlesolving but the pieces fit together to create a beautiful picture  	1
this is the number one best th game in the series  	1
it deserves strong love  	1
it is an insane game  	1
there are massive levels massive unlockable characters its just a massive game  	1
waste your money on this game  	1
this is the kind of money that is wasted properly  	1
actually the graphics were good at the time  	1
as they say in canada this is the fun game aye  	1
this game rocks  	1
buy it play it enjoy it love it  	1
its pure brilliance  	1
the film succeeds despite or perhaps because of an obviously meagre budget  	1
im glad the film didnt go for the most obvious choice as a lesser film certainly would have  	1
in addition to having one of the most lovely songs ever written french cancan also boasts one of the cutest leading ladies ever to grace the screen  	1
its hard not to fall headoverheels in love with that girl  	1
excellent cast story line performances  	1
totally believable  	1
anne heche was utterly convincing  	1
sam shepards portrayal of a gung ho marine was sobering  	1
i sat riveted to the tv screen  	1
all in all i give this one a resounding 9 out of 10  	1
i do think tom hanks is a good actor  	1
i enjoyed reading this book to my children when they were little  	1
there are some generally great things in it  	1
the suspense builders were good & just cross the line from g to pg  	1
i especially liked the noncliche choices with the parents; in other movies i could predict the dialog verbatim but the writing in this movie made better selections  	1
if you want a movie thats not gross but gives you some chills this is a great choice  	1
alexander nevsky is a great film  	1
he is an amazing film artist one of the most important whoever lived  	1
this if the first movie ive given a 10 to in years  	1
if there was ever a movie that needed wordofmouth to promote this is it  	1
overall the film is interesting and thoughtprovoking  	1
plus it was wellpaced and suited its relatively short run time  	1
give this one a look  	1
i gave it a 10  	1
the wind and the lion is well written and superbly acted  	1
it is a true classic  	1
it actually turned out to be pretty decent as far as blist horror/suspense films go  	1
definitely worth checking out  	1
manna from heaven is a terrific film that is both predictable and unpredictable at the same time  	1
the scenes are often funny and occasionally touching as the characters evaluate their lives and where they are going  	1
the cast of veteran actors are more than just a nostalgia trip  	1
ursula burtons portrayal of the nun is both touching and funny at the same time with out making fun of nuns or the church  	1
if you are looking for a movie with a terrific cast some good musicincluding a shirley jones rendition of "the way you look tonight" and an uplifting ending give this one a try  	1
i dont think you will be disappointed  	1
the only thing really worth watching was the scenery and the house because it is beautiful  	1
but in terms of the writing its very fresh and bold  	1
the acting helps the writing along very well maybe the idiotsavant sister could have been played better and it is a real joy to watch  	1
some applause should be given to the "preludehowever  	1
i really liked that  	1
a great film by a great director  	1
the movie had you on the edge of your seat and made you somewhat afraid to go to your car at the end of the night  	1
the music in the film is really nice too  	1
id advise anyone to go and see it  	1
brilliant  	1
10/10  	1
i liked this movie way too much  	1
it rocked my world and is certainly a must see for anyone with no social or physical outlets  	1
this is definitely a cult classic well worth viewing and sharing with others  	1
also its a real treat to see anthony quinn playing crazy horse  	1
still i do like this movie for its empowerment of women; theres not enough movies out there like this one  	1
an excellent performance from ms  	1
garbo who showed right off the bat that her talents could carry over from the silent era i wanted to see some of her silent work but netflix doesnt seem to be stocking them  	1
its also great to see that renowned silent screenwriter frances marion hasnt missed a step going from silent to sound  	1
youll love it  	1
the movie i received was a great quality film for its age  	1
john wayne did an incredible job for being so young in the movie industry  	1
his on screen presence shined thought even though there were other senior actors on the screen with him  	1
i think that it is a must see older john wayne film  	1
jamie foxx absolutely is ray charles  	1
his performance is simply genius  	1
he owns the film just as spacek owned "coal miners daughterand quaid owned "great balls of fire  	1
in fact its hard to remember that the part of ray charles is being acted and not played by the man himself  	1
ray charles is legendary  	1
ray charles life provided excellent biographical material for the film which goes well beyond being just another movie about a musician  	1
hitchcock is a great director  	1
secondly hitchcock pretty much perfected the thriller and chase movie  	1
when i first watched this movie in the 80s i loved it  	1
i was totally fascinated by the music the dancing everything  	1
if good intentions made a film great then this film might be one of the greatest films ever made  	1
the film has great actors a master director a significant themeat least a wouldbe significant theme undertone of fifties existential worldweariness aerial scenes that ought to have thrilled both senses and imagination and characters about which one might deeply care  	1
yet i enjoy watching it  	1
that was nice  	1
that was funny  	1
it was so funny  	1
***spoilers*** whatever else can or cant be said about it surface is superbly crafted  	1
the cinematography is simply stunning to say the least and the fx are nothing if not stateoftheart  	1
conceptually the show offers a little bit of everything and for just about everybody parents kids fantasy and/or fx fans  	1
and there wasnt a single sour note struck actingwise either; some surprisingly solid casting here  	1
all things considered a job very well done  	1
thanks good a movie like this was done and released  	1
one of the best mexican movies ever and one of the less understood even by mexican themselves no matter how identified the should have felt with it  	1
it ranks highly as a great noircrimedrama incredible performances by belmondo and lino ventura  	1
the attention given to every character and complex psychological portrayals detailing loyalty treachery love and hope are tremendous  	1
it is an excellent drama an excellent thriller and an excellent film  	1
up there with the best of melville  	1
everything about this film is simply incredible  	1
you truly take this journey through the eyes and soul of a child  	1
black water is a thriller that manages to completely transcend its limitations its an indie flick by continually subverting expectations to emerge as an intense experience  	1
the performances are real and gripping the crocdodile is extremely well done indeed if the black water website is to be believed thats because they used real crocs and the swamp location is fabulous  	1
i thoroughly enjoyed it when christopher eccleston took control of the tardis and the continuation of the series  	1
there is a lot of beautiful places  	1
an amazing finale to possibly the best trilogy of all time  	1
kieslowski never ceases to amaze me  	1
he is one of my favourite directors and one of the most talented directors in the history of cinema  	1
his use of the colours of the french flag in the three films was nothing short of incredible every shot every scene was like a work of art  	1
three of the most visually appealing movies ive ever seen  	1
and his subtle connections between the three films are awesome  	1
i have to mention this and it is a huge spoiler i loved the ending how all the characters of the three films were the remaining survivors of the ferry disaster with valentine and the young judge together and the old man watching it on her tv solidifying his happiness over the suffering which he dealt with for those many years  	1
i couldnt think of a better way to end the film but a smile on my face great way to wrap up an amazing film and trilogy  	1
i recommend this for everyone who loves film movies anythinga work of art  	1
10 out of 10 for both the movie and trilogy  	1
i think i was one of the people who found this another one of roths pearls  	1
his performance as awarded was stunning  	1
the story which was told so eloquently by francis ford coppola 25 years earlier really unfolds gradually and leaves room for the characters to develop  	1
in a most wonderful location lies a story of contrast  	1
all in all a beautiful directed film from nicolas roeg wih a sublime cast  	1
this is such a fun and funny movie  	1
highly entertaining at all angles  	1
it features an outlandish array of memorable psychotic but lovable nuts  	1
so for our enjoyment we get to see them run around play games and be dangerous  	1
it even has its sweet moments  	1
the telephone repair man was really funny and his reactions to the nuts and bitchy boss were truly genuine  	1
all the characters in this film are tremendously well played  	1
and i really did find them funny  	1
this is actually a very smart movie  	1
there is a brilliant twist ending  	1
i love it  	1
the ending is so so perfect youll shed a tear  	1
i am so thrilled after seeing a movie like this  	1
i will never forget it now  	1
it is not just a cult it is a cult classic  	1
it is a really good show to watch  	1
it is very educational for children 1 to 8 years old  	1
barney is definitely super de duper  	1
is pretty funny  	1
babie bop is very cute  	1
the kids are very cool too  	1
i would give this television series a 10 plus if i could  	1
the writers were "smack onand i think the best actors and actresses were a bonus to the showthese characters were so real  	1
i must say i have taped most of the episodes and i find myself watching them over and over again  	1
now you know why i gave it a 10+  	1
i dont know exactly what it is about this movie but we latched on to this endearing movie and it has become a special part of our familys memories  	1
i totally and absolutely recommend this movie to anyone who likes good wholesome family movies because that is exactly what this is  	1
the things that the four kids get themselves into is absolutely hilarious to watch  	1
this is one of the best movies out there that shows such strong sibling bond for each other  	1
much more interesting more action more suspense and less of the unneeded controversy  	1
everything from acting to cinematography was solid  	1
definitely worth checking out  	1
damian is so talented and versatile in so many ways of writing and portraying different characters on screen  	1
this movie has a cutting edge to it  	1
i am so pleased to know such a modern day genius is out there  letting is passion for art drive him and taking us as an audience with him  	1
elias koteasjack palance play good roles angelina is hot and gets nakedbilly drago appears in this and is cool as usual + a cameo by sven ole thorsen helps make this a very enjoyable movie with good acting and a decent budget  	1
this was such an awesome movie that i bought it off of ebay  	1
i really loved the story line and the poler bear was kinda cutebut if anyone has a question about fort steele just ask away  	1
i think the most wonderful parts literally full of "wonder" are the excerpts from his works  	1
the sets especially designed to work with the camera are amazingstylized beautiful and effective  	1
they could be used as exemplars for any set designer  	1
the stories were powerful explorations of the nature of man and of art  	1
after watching this film i wanted to learn more about the works of this artist  	1
i highly recommend this movie for anyone interested in art poetry theater politics or japanese history  	1
here in the wind and the lion we see a wonderful rendering of americas own imperial age  	1
 what makes this story different are the terrific production values  faultless photography composition and editing  the terrific casting  the underappreciated brian keith playing a bully teddy  and vivid history  	1
though the wind and the lion is told largely through the eyes of the son every member of the family can identify with one of the characters whether it be sean connerys noble brigand candace bergens feisty heroine john hustons wily john hay or steve kanalys spiffy radiant ruthless cando lieutenant roosevelts "big stick"  	1
this is high adventure at its best  	1
i think it was robert ryans best film because he portrayed someone like my father and he was a schizophrenic in real lifemy father although he never murdered anyone but was affected more so during the second world war which made him worse  	1
having to humour him just to get by and get through the day was so apt  	1
my mother and brother had to do thiswhen i saw robert ryan portraying this type of man it was a very good imitation of this type of individual and i was impressed  	1
nonlinear narration thus many flashbacks and every part are articulated quite well  	1
the good cinematography also makes her and monica bellucci look very beautiful  	1
a good commentary of todays love and undoubtedly a film worth seeing  	1
for people who are first timers in film making i think they did an excellent job  	1
it was very popular when i was in the cinema a good house and very good reactions and plenty of laughs  	1
its a feelgood film and thats how i felt when i came out of the cinema  	1
it has northern humour and positive about the community it represents  	1
i rather enjoyed it  	1
i liked it  	1
it really created a unique feeling though  	1
vivian schilling did an excellent job with the script  	1
a world better than 95% of the garbage in the theatres today  	1
her role was played well  	1
not too screamy not to masculine but just right  	1
the camera really likes her in this movie  	1
i would have casted her in that role after ready the script  	1
as a european the movie is a nice throwback to my time as a student in the 1980s and the experiences i had living abroad and interacting with other nationalities although the circumstances were slightly different  	1
this movie is excellentangel is beautiful and scamp is adorablehis little yelps when hes scaredand the funniest parts are whenscamp is caught under the curtain and when angel and scamp are singing ive never had this feeling beforei totally recommend this movieits coming out on special edition on june 20the cover has scamp on a garbage can and angel underneath the lid  	1
i just cant explain this movie more than romanticcharminghilariousand adorablethe junkyard scenes are funnyall the junkyard dogs have something specialtoo funny i laughedkids will love itbuy it when it comes outit has new features  	1
an interesting premise and billy drago is always good as a dangerous nutbag side note id love to see drago stephen mchattie and lance hendrikson in a flick together; talk about raging cheekbones  	1
the soundtrack wasnt terrible either  	1
still it was the sets that got a big "10on my "oyveyscale  	1
both do good jobs and are quite amusing  	1
the last 15 minutes of movie are also not bad as well  	1
i like armand assante & my cable companys summary sounded interesting so i watched it twice already and probably will again  	1
i believe the screenwriter did a good job of tying up the loose ends  	1
my 8/10 score is mostly for the plot  	1
i wont say any more  i dont like spoilers so i dont want to be one but i believe this film is worth your time  	1
i was deeply impressed with the character he played  	1
i knew when i saw the film that more great things were to come from this gifted actor  	1
i loved this movie it was a great portrayal of a family who had its share of ups and down but in the end they knew that special love they had for each other  	1
i have seen many movies starring jaclyn smith but my god this was one of her best though it came out 12 years ago  	1
this movie contained an allstar cast and what i loved the most was that it opened my eyes to see other actors who i havent seen before  	1
this movie was kind of long in length but i enjoyed every minute of it  	1
overall i rate this movie a 10 out of a 110 scale  	1
lifetime does not air it enough so if anyone knows what store sells it let me know because this is a musthave  	1
totally different with loads of understatement and black comedy this is a film few get to see but those who do will remember it  	1
this movie creates its own universe and is fascinating in every way  	1
but this movie really got to me  	1
see it  	1
i really hope the team behind this movie makes more movies and that they will continue to do so in their own some kinda weird style  	1
and i forgot the casting here i superb with trond fausa aurvåg being perfect in the role as the bothersome man who doesnt understand where he is what he is doing and why  	1
this movie is a good and humorous comment on life in 2006  	1
i found this move beautiful enjoyable and uplifting  	1
initially the local sites in the film which was filmed here in buffalo intrigued me  	1
later i found myself lost in the power of the film  	1
the entire audience applauded at the conclusion of the film  	1
i left the theater with a lilt in my step joy in my heart and hope for the human race  	1
duris has a wholesome appearance and gives a fine performance  	1
the rest of the cast also play well  	1
cinematography noteworthy including fine views of barcelona and its famed gaudi towers  	1
the cast is good  	1
for that its worth checking out  	1
the cast was great  	1
steve martin delivers a really funny performance of a middleaged upper class uptight white guy  	1
add betty white and jean smart and you have a great cast  everyone played their parts really well  	1
steamboat willie is an amazingly important film to our cinema history  	1
this second appearance of mickey mouse following the silent plane crazy earlier that year is probably his most famous filmmostly because it was so groundbreaking  	1
while you dont yet hear mickey speak there are tons of sound effects and music throughout the filmsomething we take for granted now but which was a huge crowd pleaser in 1928  	1
however after seeing the short again after about 25 years i was amazed at how timeless the film actually is  	1
its just adorable seeing mickey playing "turkey in the strawin a highly imaginative if occasionally cruel way  	1
clever and a real crowdpleaserthis film still ranks among mickeys best films even after 80 wonderful years  	1
the original body and soul 1947 is a masterpiece  	1
john garfield ann revere lilli plmer william conrad canada leeand filmed by one of the greatest cinematographers to ever grace the screenjames wong howe  	1
okay i like to consider myself a fair critic so ill give credit where credits duethe creature effects were actually pretty cool  	1
gotta love those closeups of slimy drooling teeth  	1
the films sole bright spot was jonah hill who will look almost unrecognizable to fans of the recent superbad due to the amount of weight he lost in the interim  	1
being a 90s child i truly enjoyed this show and i can proudly say that i enjoyed it big time and even more than the classical wb cartoons  	1
but "tiny toonskept the 90s vibe and delivered one of the most popular funny and underrated cartoons ever created  	1
the memories are murky but i can only say that i enjoyed every single episode and product related to the show  	1
easily none other cartoon made me laugh in a tender way before getting into dark sitcoms oriented for teenagers  	1
the characters were all funny and had the peculiarity of not having a true lead character  	1
every single character was hilarious and deserved to be called a lead  	1
perabo has a nice energy level and is obviously very comfortable in front of a camera  	1
i believe that pitch black was done well  	1
the characters are interesting and you want to find out more about them the longer the movie goes on and i think people will be surprised by who does and doesnt make it  	1
go watch it  	1
very funny  	1
the characters are interesting and you really care for them  	1
an instant classic with a great soundtrack and a catchy song during the ending credits  	1
dont miss it  	1
this is a masterful piece of filmmaking with many themes simmering and occasionally boiling over in this warts and all study of the poets bohemian selfindulgent wartime years that span the aerial bombardments of london and the outward tranquillity of a welsh coastal retreat  the borderlines between friendship lust and love dedication to art and experience versus practical concerns jealousy rivalry cowardice and egotism versus heroism and selfsacrifice and more  	1
a mature subtle script that suggests and occasionally brings into dramatic focus the underlying tensions is well served by perfect performances apart from the odd inappropriate smiling that keira knightley is prone to though perhaps under direction this time as the other characters themselves often mention it  	1
but above all the exquisite visual composition of each moment with inventive and elegant use of closeup camera angle and lighting including pointillistic faux home movie footage is a wonder and joy to behold  	1
its as continuously beautiful to look at as a bertolucci but the relationships here are more convincing and the narrative more engaging than some of that masters work  	1
i saw this film over christmas and what a great film it was  	1
i thought errol flynn was brilliant as custer and has since become my favourite actor  	1
his acting alongside olivia de havilland was brilliant and the ending was fantastic  	1
